Source,Relationship,Target,Reason,Evidence URL,Evidence Text
Centene,partner_of,McCormack Baron Salazar,Centene Foundation launched an initiative to increase access to affordable housing in partnership with McCormack Baron Salazar (listed as related news on the Strategic Partnerships page).,https://www.centene.com/why-were-different/strategic-partnerships.html,“Centene Foundation Launches Innovative Initiative to Increase Access to Affordable Housing in Partnership with McCormack Baron Salazar”
Centene,uses,Coupa,Centene states it uses the Coupa platform to interact with existing suppliers (RFPs and transaction processing).,https://www.centene.com/why-were-different/strategic-partnerships/centene-suppliers.html,"“Centene uses the Coupa platform for interacting with existing suppliers, including requests for proposals (RFP) and transaction processing.”"
Centene,uses,SupplierOne,"Centene directs prospective suppliers to register on its Supplier Portal hosted at centene.supplierone.co, indicating use of SupplierOne as a supplier portal platform.",https://www.centene.com/why-were-different/strategic-partnerships/centene-suppliers.html,"“If you are interested in becoming a supplier for Centene, please register on our Supplier Portal. Register” (links to https://centene.supplierone.co)"
Centene,uses,Sinch,"Centene's Partner Portal API Catalog lists multiple Sinch-related APIs (e.g., 'Sinch Production' and SMS user response webhooks), indicating Centene uses Sinch as a vendor/integration for SMS/user response functionality.",https://partners.centene.com/apis,“Sinch Production … Sinch User Response for production”
Centene,partner_of,OneRecord,"Centene's Third Party Application Developer onboarding page lists OneRecord under 'Currently Connected Applications', indicating OneRecord has an approved/connected integration with Centene APIs as a third-party application developer partner.",https://partners.centene.com/applicationDeveloper,“Currently Connected Applications OneRecord … OneRecord’s Website”
Centene,partner_of,Flexpa,"Centene's Third Party Application Developer onboarding page lists Flexpa under 'Currently Connected Applications', indicating Flexpa has an approved/connected integration with Centene APIs as a third-party application developer partner.",https://partners.centene.com/applicationDeveloper,“Currently Connected Applications … Flexpa … Flexpa’s Website”
Centene,partner_of,B.Well,"Centene's Third Party Application Developer onboarding page lists B.Well under 'Currently Connected Applications', indicating B.Well has an approved/connected integration with Centene APIs as a third-party application developer partner.",https://partners.centene.com/applicationDeveloper,“Currently Connected Applications … B.Well … B.Well’s Website”
