Source,Relationship,Target,Reason,Evidence URL,Evidence Text
fbin.com,partner_of,ADT,FBIN story announces a new partnership where Yale Assure Lock 2 will be the preferred smart lock for ADT residential customers and integrates with ADT+ / Trusted Neighbor offering.,https://www.fbin.com/stories/yale-and-adt-enter-nationwide-partnership/,"“We recently announced an exciting new partnership with ADT. Under this agreement, the Yale Assure Lock 2 collection will be the preferred smart lock for ADT residential customers across the country. The lock collection will integrate with ADT’s new Trusted Neighbor™ offering…”"
fbin.com,partner_of,Yale,"FBIN (Fortune Brands Innovations) describes Yale product line (Yale Assure Lock 2) as part of its Security segment and discusses partnership announcement involving Yale, implying Yale is a brand/company relationship within FBIN context.",https://www.fbin.com/stories/yale-and-adt-enter-nationwide-partnership/,"“Under this agreement, the Yale Assure Lock 2 collection will be the preferred smart lock for ADT residential customers…”"
fbin.com,partner_of,Moen,"Page highlights 'Flo Smart Water Monitor and Shutoff' and 'Moen Smart Water Network' as FBIN connected products, explicitly stating Flo is the hub of the Moen Smart Water Network (product ecosystem relationship).",https://www.fbin.com/our-story/connected-products/,“Flo is the hub of the Moen Smart Water Network.”
fbin.com,partner_of,Flo,"FBIN connected products page lists 'Flo Smart Water Monitor and Shutoff' as a FBIN offering and describes it as the hub of Moen Smart Water Network, indicating Flo is a connected-products brand within FBIN's portfolio/ecosystem.",https://www.fbin.com/our-story/connected-products/,“Flo Smart Water Monitor and Shutoff … Flo is the hub of the Moen Smart Water Network.”
fbin.com,partner_of,August Home,"FBIN connected products page lists August Home under 'See Our Products', indicating a brand/portfolio relationship in connected products.",https://www.fbin.com/our-story/connected-products/,“August Home — Smarter home access that frees you.”
fbin.com,partner_of,Master Lock,"FBIN connected products page lists Master Lock connected solutions (c LOTO Solution, Commercial Connected Access) as part of its connected products, indicating a brand/portfolio relationship.",https://www.fbin.com/our-story/connected-products/,“Master Lock c LOTO™ Solution … Master Lock is digitizing Lockout Tagout (LOTO) programs…”
fbin.com,partner_of,Aqualisa,"FBIN connected products page lists Aqualisa smart showers as part of its connected products lineup, indicating a brand/portfolio relationship.",https://www.fbin.com/our-story/connected-products/,“Aqualisa — Smart showers that combine the precise electronic control of a digital shower with the modern convenience of voice and app activation.”
