Source,Relationship,Target,Reason,Evidence URL,Evidence Text
kengarff.com,uses,Gubagoo,"Gubagoo case study states Ken Garff Automotive Group switched to Gubagoo in 2021 and uses Offer Builder/Virtual Retailing in online conversations, indicating use of Gubagoo's digital retailing/chat platform.",https://www.gubagoo.com/case-study-ken-garff-automotive-group,"""After making the switch to Gubagoo in 2021... They use Offer Builder as an engagement tool to send payment options to customers online"""
kengarff.com,partner_of,Tekion,Tekion blog post announces a new partnership where Ken Garff selected Tekion as a technology partner and will implement Tekion’s Automotive Retail Cloud (ARC) across its organization.,https://tekion.com/blog/ken-garff-auto-group-selects-tekion-to-create-the-best-customer-experiences,"""today announced a new partnership with Ken Garff""; ""Ken Garff has selected Tekion as its newest technology partner"""
kengarff.com,uses,Tekion Automotive Retail Cloud (ARC),"The post states Ken Garff selected Tekion to power customer experiences via Tekion’s Automotive Retail Cloud (ARC), already powering some stores and to be implemented organization-wide.",https://tekion.com/blog/ken-garff-auto-group-selects-tekion-to-create-the-best-customer-experiences,"""help deliver the best customer experiences powered by Tekion’s Automotive Retail Cloud (ARC)."""
kengarff.com,partner_of,Phyron,"LinkedIn post by Ryan Bolz says he has been tracking tests alongside Ken Garff Automotive group and Phyron, and notes Ken Garff can do video at scale with partners like Phyron; comment links to a Phyron case study about Ken Garff and Meta Automotive Inventory Ads.",https://www.linkedin.com/posts/ryanbolz_have-been-tracking-to-these-tests-alongside-activity-7424455610668314625-_KWZ,"""Have been tracking to these tests alongside the Ken Garff Automotive group and Phyron.""; ""Ken Garff Automotive saw 32% higher click through rate... AND are able to do it scale with partners like Phyron."""
kengarff.com,uses,Meta (Facebook/Instagram) Automotive Inventory Ads,"The post describes tests where Ken Garff added video to Meta inventory ads/catalogs and saw performance improvements, implying Ken Garff runs/uses Meta Automotive Inventory Ads.",https://www.linkedin.com/posts/ryanbolz_have-been-tracking-to-these-tests-alongside-activity-7424455610668314625-_KWZ,"""what happens when you add video to Meta inventory ads""; ""Meta introduced the ability to add video to catalogs for every vehicle in inventory... Ken Garff Automotive saw 32% higher click through rate""; comment references ""Meta Automotive Inventory Ads"" case study link."
