Source,Relationship,Target,Reason,Evidence URL,Evidence Text
silarealtytrust.com,uses,Computershare,"The site links investor services/forms to Computershare, indicating Sila Realty Trust uses Computershare for investor/shareholder services.",https://silarealtytrust.com/,Investors ... Log In ... https://www-us.computershare.com/Investor/#Company/Index?... and ... https://www-us.computershare.com/Investor/#Help/PrintableForms/Index?...
silarealtytrust.com,uses,Paycor,"The Careers link points to recruitingbypaycor.com, indicating Sila Realty Trust uses Paycor for recruiting/careers hosting.",https://silarealtytrust.com/,Careers ... https://recruitingbypaycor.com/career/CareerHome.action?clientId=...
silarealtytrust.com,uses,Q4 Inc.,"The investor relations site footer states it is powered by Q4 Inc., indicating Sila Realty Trust uses Q4 Inc. for its IR website platform.",https://investors.silarealtytrust.com/overview/default.aspx,"""Powered By Q4 Inc."""
silarealtytrust.com,partner_of,GI Alliance,"Press release states Sila Realty Trust acquired a portfolio where the gastroenterology center is leased to GI Alliance, making GI Alliance a tenant of Sila.",https://investors.silarealtytrust.com/news/press-releases/press-release-details/2025/Sila-Realty-Trust-Completes-Acquisition-of-a-Two-Property-Medical-Outpatient-Building-Portfolio-for-16-15-Million/default.aspx,"""The gastroenterology center is leased to GI Alliance, the largest gastroenterology group in the United States"""
silarealtytrust.com,partner_of,Baylor Scott & White Health,"Press release says the acquired ambulatory surgery center is leased to a joint venture that includes a partnership comprised of Baylor Scott & White Health, indicating Baylor Scott & White Health is part of the tenant JV for Sila's property.",https://investors.silarealtytrust.com/news/press-releases/press-release-details/2025/Sila-Realty-Trust-Completes-Acquisition-of-a-Two-Property-Medical-Outpatient-Building-Portfolio-for-16-15-Million/default.aspx,"""The ASC is leased to a joint venture between a partnership comprised of Baylor Scott & White Health and United Surgical Partners International and a group of physicians."""
silarealtytrust.com,partner_of,United Surgical Partners International,"Press release says the acquired ambulatory surgery center is leased to a joint venture that includes United Surgical Partners International, indicating USPI is part of the tenant JV for Sila's property.",https://investors.silarealtytrust.com/news/press-releases/press-release-details/2025/Sila-Realty-Trust-Completes-Acquisition-of-a-Two-Property-Medical-Outpatient-Building-Portfolio-for-16-15-Million/default.aspx,"""The ASC is leased to a joint venture between a partnership comprised of Baylor Scott & White Health and United Surgical Partners International and a group of physicians."""
silarealtytrust.com,partner_of,Tenet Healthcare,"Press release identifies United Surgical Partners International as a subsidiary of Tenet Healthcare; since USPI is part of the JV leasing Sila’s acquired ASC, Tenet is indirectly connected as parent of a tenant entity.",https://investors.silarealtytrust.com/news/press-releases/press-release-details/2025/Sila-Realty-Trust-Completes-Acquisition-of-a-Two-Property-Medical-Outpatient-Building-Portfolio-for-16-15-Million/default.aspx,"""United Surgical Partners International (“USPI”) is a for-profit subsidiary of Tenet Healthcare"""
silarealtytrust.com,partner_of,Cardinal Health,"Press release notes GI Alliance (tenant) is a subsidiary of Cardinal Health, creating an indirect relationship as parent of a tenant.",https://investors.silarealtytrust.com/news/press-releases/press-release-details/2025/Sila-Realty-Trust-Completes-Acquisition-of-a-Two-Property-Medical-Outpatient-Building-Portfolio-for-16-15-Million/default.aspx,"""The gastroenterology center is leased to GI Alliance... and a subsidiary of investment grade-rated Cardinal Health."""
silarealtytrust.com,partner_of,Regents of the University of California,Press release states Sila Realty Trust entered into a new triple-net lease agreement with the Regents of the University of California for the El Segundo Healthcare Facility.,https://r.jina.ai/http://investors.silarealtytrust.com/news/press-releases/press-release-details/2025/Sila-Realty-Trust-Announces-Fourth-Quarter-and-Year-Ended-2024-Results/default.aspx,"""Entered into a new triple-net lease agreement, effective December 13, 2024, with the Regents of the University of California for the El Segundo Healthcare Facility"""
silarealtytrust.com,partner_of,"GenesisCare USA, Inc.","Press release notes the El Segundo Healthcare Facility was previously leased to GenesisCare USA, Inc. and its affiliates, indicating GenesisCare was a (former) tenant/lessee of Sila Realty Trust for that facility; it also references an amended master lease with GenesisCare.",https://r.jina.ai/http://investors.silarealtytrust.com/news/press-releases/press-release-details/2025/Sila-Realty-Trust-Announces-Fourth-Quarter-and-Year-Ended-2024-Results/default.aspx,"""El Segundo Healthcare Facility, which was previously leased to GenesisCare USA, Inc. and its affiliates, or GenesisCare"""
silarealtytrust.com,partner_of,"Post Acute Medical, LLC","Press release states Sila Realty Trust entered into 15 amended lease agreements with certain subsidiaries of Post Acute Medical, LLC related to 15 properties, extending each lease term; also calls Post Acute Medical its largest tenant.",https://r.jina.ai/http://investors.silarealtytrust.com/news/press-releases/press-release-details/2025/Sila-Realty-Trust-Announces-Fourth-Quarter-and-Year-Ended-2024-Results/default.aspx,"""Entered into 15 amended lease agreements... with certain subsidiaries of Post Acute Medical, LLC... extending the term of each lease to a 20-year remaining lease term"""
silarealtytrust.com,partner_of,Steward Health Care,"Press release attributes part of Cash NOI decrease to a vacancy resulting from the Steward Healthcare bankruptcy, implying Steward Healthcare was a tenant/operator connected to a Sila property that became vacant due to bankruptcy.",https://r.jina.ai/http://investors.silarealtytrust.com/news/press-releases/press-release-details/2025/Sila-Realty-Trust-Announces-Fourth-Quarter-and-Year-Ended-2024-Results/default.aspx,"""...the vacancy as a result of the Steward Healthcare bankruptcy"""
silarealtytrust.com,partner_of,New York Stock Exchange (NYSE),Case study states Sila planned and executed a direct listing and debut on the NYSE.,https://view.computershare.com/sila-case-study/p/1,"""Working with Computershare, Sila Realty Trust laid plans for a direct listing on the New York Stock Exchange (NYSE)."" / ""Sila ultimately decided to make its NYSE debut through a direct listing in June of 2024."""
silarealtytrust.com,uses,"Bank of America, N.A.","Credit Agreement lists Bank of America, N.A. as Administrative Agent and an L/C Issuer for Sila Realty Trust, indicating Sila uses Bank of America for its revolving credit facility administration and letters of credit.",https://www.sec.gov/Archives/edgar/data/1567925/000156792525000003/exhibit101-silarealtytrust.htm,"""BANK OF AMERICA, N.A., as Administrative Agent and an L/C Issuer"""
silarealtytrust.com,uses,"Wells Fargo Bank, N.A.","Credit Agreement includes Wells Fargo Bank, N.A. as a Lender and an L/C Issuer, indicating Sila uses Wells Fargo for lending and letter of credit issuance under its revolving credit facility.",https://www.sec.gov/Archives/edgar/data/1567925/000156792525000003/exhibit101-silarealtytrust.htm,"""WELLS FARGO BANK, N.A., as a Lender and an L/C Issuer"""
silarealtytrust.com,uses,BMO Bank N.A.,"Credit Agreement includes BMO Bank N.A. as a Lender and an L/C Issuer, indicating Sila uses BMO for lending and letters of credit under the facility.",https://www.sec.gov/Archives/edgar/data/1567925/000156792525000003/exhibit101-silarealtytrust.htm,"""BMO BANK N.A., as a Lender and an L/C Issuer"""
silarealtytrust.com,uses,The Huntington National Bank,"Credit Agreement includes The Huntington National Bank as a Lender and an L/C Issuer, indicating Sila uses Huntington for lending and letters of credit under the facility.",https://www.sec.gov/Archives/edgar/data/1567925/000156792525000003/exhibit101-silarealtytrust.htm,"""THE HUNTINGTON NATIONAL BANK, as a Lender and an L/C Issuer"""
silarealtytrust.com,uses,Truist Bank,"Credit Agreement includes Truist Bank as a Lender and an L/C Issuer for the facility, indicating Sila uses Truist for lending/LOCs.",https://www.sec.gov/Archives/edgar/data/1567925/000156792525000003/exhibit101-silarealtytrust.htm,"""TRUIST BANK, as a Lender and an L/C Issuer"""
silarealtytrust.com,uses,"Citibank, N.A.","Credit Agreement lists Citibank, N.A. as Documentation Agent and also as a Lender, indicating Sila uses Citi as part of its revolving credit facility lender group and documentation agent role.",https://www.sec.gov/Archives/edgar/data/1567925/000156792525000003/exhibit101-silarealtytrust.htm,"""CITIBANK, N.A., as Documentation Agent"" / ""CITIBANK, N.A., as a Lender"""
silarealtytrust.com,uses,"BofA Securities, Inc.","Credit Agreement names BofA Securities, Inc. as a Joint Lead Arranger and Joint Bookrunner, indicating Sila used BofA Securities to arrange/bookrun the revolving credit facility.",https://www.sec.gov/Archives/edgar/data/1567925/000156792525000003/exhibit101-silarealtytrust.htm,"""BOFA SECURITIES, INC., ... as Joint Lead Arrangers and Joint Bookrunners"""
silarealtytrust.com,uses,"Wells Fargo Securities, LLC","Credit Agreement names Wells Fargo Securities, LLC as a Co-Syndication Agent and as a Joint Lead Arranger/Joint Bookrunner, indicating Sila used Wells Fargo Securities for syndication/arranging the facility.",https://www.sec.gov/Archives/edgar/data/1567925/000156792525000003/exhibit101-silarealtytrust.htm,"""WELLS FARGO SECURITIES, LLC, ... as Co-Syndication Agents"" / ""WELLS FARGO SECURITIES, LLC, ... as Joint Lead Arrangers and Joint Bookrunners"""
silarealtytrust.com,uses,"Truist Securities, Inc.","Credit Agreement names Truist Securities, Inc. as a Co-Syndication Agent and as a Joint Lead Arranger/Joint Bookrunner, indicating Sila used Truist Securities for syndication/arranging the facility.",https://www.sec.gov/Archives/edgar/data/1567925/000156792525000003/exhibit101-silarealtytrust.htm,"""TRUIST SECURITIES, INC., as Co-Syndication Agents"" / ""TRUIST SECURITIES, INC., ... as Joint Lead Arrangers and Joint Bookrunners"""
silarealtytrust.com,uses,First Horizon Bank,"Credit Agreement signature pages list First Horizon Bank as a Lender, indicating Sila uses First Horizon as part of its lending syndicate.",https://www.sec.gov/Archives/edgar/data/1567925/000156792525000003/exhibit101-silarealtytrust.htm,"""FIRST HORIZON BANK, as a Lender"""
silarealtytrust.com,uses,United Community Bank,"Credit Agreement signature pages list United Community Bank as a Lender, indicating Sila uses it as part of its lending syndicate.",https://www.sec.gov/Archives/edgar/data/1567925/000156792525000003/exhibit101-silarealtytrust.htm,"""UNITED COMMUNITY BANK, as a Lender"""
silarealtytrust.com,uses,Valley National Bank,"Credit Agreement signature pages list Valley National Bank as a Lender, indicating Sila uses it as part of its lending syndicate.",https://www.sec.gov/Archives/edgar/data/1567925/000156792525000003/exhibit101-silarealtytrust.htm,"""VALLEY NATIONAL BANK, as a Lender"""
silarealtytrust.com,uses,Eastern Bank,"Credit Agreement signature pages list Eastern Bank as a Lender, indicating Sila uses it as part of its lending syndicate.",https://www.sec.gov/Archives/edgar/data/1567925/000156792525000003/exhibit101-silarealtytrust.htm,"""EASTERN BANK, as a Lender"""
silarealtytrust.com,uses,Hancock Whitney Bank,"Credit Agreement signature pages list Hancock Whitney Bank as a Lender, indicating Sila uses it as part of its lending syndicate.",https://www.sec.gov/Archives/edgar/data/1567925/000156792525000003/exhibit101-silarealtytrust.htm,"""HANCOCK WHITNEY BANK, as a Lender"""
silarealtytrust.com,uses,Renasant Bank,"Credit Agreement signature pages list Renasant Bank as a Lender, indicating Sila uses it as part of its lending syndicate.",https://www.sec.gov/Archives/edgar/data/1567925/000156792525000003/exhibit101-silarealtytrust.htm,"""RENASANT BANK, as a Lender"""
silarealtytrust.com,uses,Cadence Bank,"Credit Agreement signature pages list Cadence Bank as a Lender, indicating Sila uses it as part of its lending syndicate.",https://www.sec.gov/Archives/edgar/data/1567925/000156792525000003/exhibit101-silarealtytrust.htm,"""CADENCE BANK, as a Lender"""
