Source,Relationship,Target,Reason,Evidence URL,Evidence Text
tvguide.com,vendor_of,Lee Enterprises,"The article says Lee Enterprises has a partnership with NTVB Media that delivers daily “What to Watch” recommendations to more than 200 newspapers; as NTVB owns/publishes TV Guide Magazine and provides TV/entertainment content, this indicates TV Guide/NTVB content is supplied to Lee Enterprises.","https://r.jina.ai/http://www.editorandpublisher.com/stories/behind-the-screen-how-ntvb-media-helps-publishers-engage-readers-and-grow-revenue,257604","“At Lee Enterprises, a partnership with NTVB Media delivered daily “What to Watch” recommendations to more than 200 newspapers…”"
tvguide.com,reseller_of,Lee Enterprises,"The article describes ad campaigns where Lee runs quarter-page ads in its newspapers to promote TV Weekly magazine (an NTVB/TV Guide-related publication) and receives a commission for each new subscriber, implying Lee acts as a reseller/affiliate for NTVB subscriptions.","https://r.jina.ai/http://www.editorandpublisher.com/stories/behind-the-screen-how-ntvb-media-helps-publishers-engage-readers-and-grow-revenue,257604",“We’ve done several ad campaigns where Lee runs quarter-page ads in all of their newspapers to promote TV Weekly magazine… we pay Lee a commission on every new subscriber we get from the ads.”
tvguide.com,vendor_of,The Villages Daily Sun,"The article states The Villages Daily Sun launched a magazine insert (“Classics”) built around NTVB’s ReMIND content, with NTVB formatting it and creating prototypes/sections, indicating NTVB (owner/publisher of TV Guide Magazine) provides content/production services to the publisher.","https://r.jina.ai/http://www.editorandpublisher.com/stories/behind-the-screen-how-ntvb-media-helps-publishers-engage-readers-and-grow-revenue,257604","“The Villages Daily Sun launched Classics, a 24-page nostalgia-driven magazine built around NTVB’s ReMIND magazine and website content.”"
tvguide.com,partner_of,Comcast,SEC filing states Gemstar-TV Guide entered into an IPG development joint venture with Comcast (Guideworks) and also has a patent/content distribution license with Comcast for TV Guide brand/content and IP technology on Comcast’s IPG.,https://r.jina.ai/https://www.sec.gov/Archives/edgar/data/923282/000119312505084405/dars.htm,"“The Company entered into an IPG development joint venture with Comcast… The joint venture, called Guideworks”"
tvguide.com,partner_of,Guideworks LLC,The filing describes Guideworks LLC as a joint venture formed by Gemstar-TV Guide and Comcast to develop interactive program guides (i-Guide/i-Guide development).,https://r.jina.ai/https://www.sec.gov/Archives/edgar/data/923282/000119312505084405/dars.htm,"“The joint venture, called Guideworks, introduced our new interactive program guide, i-Guide”"
tvguide.com,partner_of,EchoStar,The filing says Gemstar-TV Guide reached affiliate and patent license agreements with EchoStar; also notes EchoStar’s Dish Network debuted TVG Network’s interactive wagering application; and that Gemstar sold SNG businesses to EchoStar and entered a license/distribution agreement.,https://r.jina.ai/https://www.sec.gov/Archives/edgar/data/923282/000119312505084405/dars.htm,“reaching important affiliate and patent license agreements with distributors including EchoStar”
tvguide.com,partner_of,DirecTV,The filing lists DirecTV as a distributor with which Gemstar-TV Guide reached affiliate and patent license agreements and describes an agreement where DirecTV pays recurring fees for set-top box/IPG licensing.,https://r.jina.ai/https://www.sec.gov/Archives/edgar/data/923282/000119312505084405/dars.htm,“reaching important affiliate and patent license agreements with distributors including… DirecTV”
tvguide.com,partner_of,Comcast Cable,The filing says Comcast began launching its version of i-Guide to subscribers and other distribution partners committed to rolling out i-Guide; indicates distribution/technology partnership for IPG deployment.,https://r.jina.ai/https://www.sec.gov/Archives/edgar/data/923282/000119312505084405/dars.htm,“Comcast began launching its version of this new IPG to its subscribers in October… deployed in approximately 3 million Comcast homes”
tvguide.com,partner_of,Adelphia Communications,The filing states Adelphia committed to rolling out i-Guide and also lists Adelphia as having license and distribution agreements with Gemstar-TV Guide.,https://r.jina.ai/https://www.sec.gov/Archives/edgar/data/923282/000119312505084405/dars.htm,"“Several of our other distribution partners, including Adelphia… have committed to rolling out i-Guide.”"
tvguide.com,partner_of,Mediacom,"The filing states Mediacom committed to rolling out i-Guide, indicating distribution partnership for TV Guide Interactive IPG.",https://r.jina.ai/https://www.sec.gov/Archives/edgar/data/923282/000119312505084405/dars.htm,"“Several of our other distribution partners, including Adelphia, Mediacom, and RCN, also have committed to rolling out i-Guide.”"
tvguide.com,partner_of,RCN,"The filing states RCN committed to rolling out i-Guide, indicating distribution partnership for TV Guide Interactive IPG.",https://r.jina.ai/https://www.sec.gov/Archives/edgar/data/923282/000119312505084405/dars.htm,"“Several of our other distribution partners, including Adelphia, Mediacom, and RCN, also have committed to rolling out i-Guide.”"
tvguide.com,partner_of,Charter Communications,The filing lists Charter Communications among MSO/DBS providers with which Gemstar-TV Guide has license and distribution agreements for IPG/data/patent licensing.,https://r.jina.ai/https://www.sec.gov/Archives/edgar/data/923282/000119312505084405/dars.htm,"“We have license and distribution agreements with the majority of the MSOs and DBS providers including Adelphia Communications, Charter Communications, Comcast… Time Warner Cable, DirecTV and EchoStar”"
tvguide.com,partner_of,Time Warner Cable,The filing lists Time Warner Cable as an MSO partner with license and distribution agreements; also mentions negotiations and an agreement with Time Warner Cable regarding carriage of TV Guide On Screen data in VBI/digital signal.,https://r.jina.ai/https://www.sec.gov/Archives/edgar/data/923282/000119312505084405/dars.htm,“We have license and distribution agreements with the majority of the MSOs… including… Time Warner Cable”
tvguide.com,uses,Nielsen,"The filing repeatedly references Nielsen measurement for TV Guide Channel distribution and ratings and Nielsen Designated Media Markets for data delivery, indicating reliance on Nielsen metrics/definitions.",https://r.jina.ai/https://www.sec.gov/Archives/edgar/data/923282/000119312505084405/dars.htm,"“As of December 31, 2004, TV Guide Channel was distributed to 76.7 million households as measured by Nielsen.”"
tvguide.com,vendor_of,Marriott,SkyMall (part of Gemstar-TV Guide) operates loyalty programs for Marriott where SkyMall provides merchandising/fulfillment and Marriott pays SkyMall for products purchased with loyalty points.,https://r.jina.ai/https://www.sec.gov/Archives/edgar/data/923282/000119312505084405/dars.htm,"“SkyMall also operates programs for Marriott… Under these programs, SkyMall contracts directly with the Loyalty Partner to provide merchandising, fulfillment, customer and other related services.”"
tvguide.com,vendor_of,National Datacast,"The filing states TV Guide On Screen uses VBI/digital equivalent in signals of PBS (through National Datacast) and other networks to supply listings data, indicating National Datacast provides PBS signal/data carriage used for TV Guide On Screen updates.",https://r.jina.ai/https://www.sec.gov/Archives/edgar/data/923282/000119312505084405/dars.htm,“We use… the local affiliates of major broadcast networks such as PBS (through National Datacast)… to supply program listing information to our IPGs incorporated in CE products”
tvguide.com,vendor_of,Norpak Corporation,"The filing says Norpak, a majority-owned subsidiary, manufactures and supplies VBI insertion equipment used to deliver listings data for TV Guide On Screen/CE IPGs.",https://r.jina.ai/https://www.sec.gov/Archives/edgar/data/923282/000119312505084405/dars.htm,“Norpak Corporation… manufactures and supplies us with the VBI insertion equipment.”
tvguide.com,partner_of,"Youbet.com, Inc.",The filing states Youbet.com licenses certain IP from TVG Network and sublicenses audiovisual and wagering rights; TVG is paid a royalty based on wagering processed by Youbet.com.,https://r.jina.ai/https://www.sec.gov/Archives/edgar/data/923282/000119312505084405/dars.htm,"“Youbet.com, Inc. … license certain intellectual property and sublicense certain audiovisual and pari-mutuel account wagering rights from TVG Network.”"
tvguide.com,partner_of,"America TAB, Ltd.",The filing states America TAB licenses certain IP and sublicenses certain audiovisual and wagering rights from TVG Network; TVG is paid a royalty based on wagering processed.,https://r.jina.ai/https://www.sec.gov/Archives/edgar/data/923282/000119312505084405/dars.htm,"“Youbet.com, Inc. and America TAB, Ltd. license certain intellectual property and sublicense certain audiovisual and pari-mutuel account wagering rights from TVG Network.”"
tvguide.com,partner_of,National Thoroughbred Racing Association,The filing says TVG Network is an exclusive marketing partner of the National Thoroughbred Racing Association.,https://r.jina.ai/https://www.sec.gov/Archives/edgar/data/923282/000119312505084405/dars.htm,“TVG Network is an exclusive marketing partner of the National Thoroughbred Racing Association”
tvguide.com,partner_of,Fox Sports Net,"The filing states TVG Network is carried on Fox Sports Net in ~5 million southern California homes for two or more hours five days a week, indicating distribution partnership.",https://r.jina.ai/https://www.sec.gov/Archives/edgar/data/923282/000119312505084405/dars.htm,“TVG Network is carried on Fox Sports Net in approximately 5.0 million southern California homes for two hours or more five days a week.”
